{
  "schema_version": "1.0.0",
  "source": "js/config.js",
  "generated_at": "2026-03-01T12:06:20.730Z",
  "quests": [
    {
      "id": "aftershock",
      "title": "Aftershock",
      "desc": "Recover your bearings after the crash and reach the village alive.",
      "objectives": [
        {
          "id": "recover_map",
          "text": "Recover your map fragment from the crash site",
          "optional": false
        },
        {
          "id": "find_village",
          "text": "Reach the nearby village",
          "optional": false
        }
      ]
    },
    {
      "id": "hearts_of_the_village",
      "title": "Hearts of the Village",
      "desc": "Build trust with local civilians to unlock routes and squad intel.",
      "objectives": [
        {
          "id": "talk_elder",
          "text": "Speak with Elder Nguyen",
          "optional": false
        },
        {
          "id": "secure_local_trust",
          "text": "Gain local trust",
          "optional": false
        },
        {
          "id": "help_thanh",
          "text": "[Optional] Help Thanh reunite with Duc",
          "optional": true
        }
      ]
    },
    {
      "id": "rescue",
      "title": "Leave No One Behind",
      "desc": "Locate the VC camp and rescue Pvt. Rodriguez.",
      "objectives": [
        {
          "id": "find_camp",
          "text": "Locate the VC camp",
          "optional": false
        },
        {
          "id": "kill_radio",
          "text": "[Optional] Destroy the radio tower",
          "optional": true
        },
        {
          "id": "free_pow",
          "text": "Rescue Pvt. Rodriguez",
          "optional": false
        }
      ]
    },
    {
      "id": "medic_down",
      "title": "Medic Down",
      "desc": "Track down Cpl. Whitaker near the abandoned mission clinic.",
      "objectives": [
        {
          "id": "locate_clinic",
          "text": "Locate the mission clinic",
          "optional": false
        },
        {
          "id": "reach_whitaker",
          "text": "Reach Cpl. Whitaker",
          "optional": false
        }
      ]
    },
    {
      "id": "field_surgery",
      "title": "Field Surgery",
      "desc": "Get medical supplies and stabilize Whitaker for movement.",
      "objectives": [
        {
          "id": "obtain_field_kit",
          "text": "Obtain a field treatment kit",
          "optional": false
        },
        {
          "id": "stabilize_whitaker",
          "text": "Stabilize Whitaker for travel",
          "optional": false
        }
      ]
    },
    {
      "id": "silent_crossing",
      "title": "Silent Crossing",
      "desc": "Secure a river crossing route for the regrouped squad.",
      "objectives": [
        {
          "id": "secure_ferry_pass",
          "text": "Secure passage at the ferry crossing",
          "optional": false
        },
        {
          "id": "cross_river",
          "text": "Cross the river corridor",
          "optional": false
        }
      ]
    },
    {
      "id": "radio_ghost",
      "title": "Radio Ghost",
      "desc": "Find Specialist Hale and convince him to rejoin the team.",
      "objectives": [
        {
          "id": "find_hale",
          "text": "Find Specialist Hale near the river hamlet",
          "optional": false
        },
        {
          "id": "convince_hale",
          "text": "Convince Hale to move with the squad",
          "optional": false
        }
      ]
    },
    {
      "id": "convoy_to_arvn",
      "title": "Convoy to ARVN",
      "desc": "Move the regrouped squad through hostile territory to ARVN lines.",
      "objectives": [
        {
          "id": "regroup_team",
          "text": "Regroup all surviving squadmates",
          "optional": false
        },
        {
          "id": "reach_arvn",
          "text": "Reach the ARVN perimeter",
          "optional": false
        }
      ]
    },
    {
      "id": "last_checkpoint",
      "title": "Last Checkpoint",
      "desc": "Clear final checkpoint protocol and enter the ARVN outpost.",
      "objectives": [
        {
          "id": "resolve_checkpoint",
          "text": "Resolve gate protocol with Sgt. Kiet",
          "optional": false
        },
        {
          "id": "enter_arvn",
          "text": "Enter the ARVN outpost",
          "optional": false
        }
      ]
    }
  ],
  "dialogue": [
    {
      "id": "elder",
      "name": "Elder Nguyen Van Tho",
      "portrait": "👴",
      "nodes": {
        "root": {
          "text": "You survived the crash. Many do not. Sit, soldier. Speak clearly, and perhaps this village can help.",
          "choices": [
            {
              "label": "Any word of my squad?",
              "go": "survivors"
            },
            {
              "label": "I need the village to trust me.",
              "go": "trust"
            },
            {
              "label": "Where is the VC camp?",
              "go": "camp"
            }
          ]
        },
        "survivors": {
          "text": "One American is caged in the VC camp. Another was seen near the old mission clinic. A radio man hides by the eastern river hamlet.",
          "choices": [
            {
              "label": "I will bring them home.",
              "go": "end",
              "actions": [
                "setFlag:talked_elder",
                "completeObjective:hearts_of_the_village:talk_elder",
                "startQuest:rescue",
                "startQuest:medic_down"
              ]
            }
          ]
        },
        "trust": {
          "text": "Trust is earned here, not demanded. Talk to Thanh, Binh, and Father Bao. Help one family and ten will remember.",
          "choices": [
            {
              "label": "I understand.",
              "go": "end",
              "actions": [
                "setFlag:talked_elder",
                "completeObjective:hearts_of_the_village:talk_elder",
                "startQuest:rescue",
                "startQuest:medic_down"
              ]
            }
          ]
        },
        "camp": {
          "text": "Northwest path, beyond the ridge and wire. They keep your man in a cage. If the radio tower stands, reinforcements will come quickly.",
          "choices": [
            {
              "label": "Then I move now.",
              "go": "end",
              "actions": [
                "setFlag:talked_elder",
                "completeObjective:hearts_of_the_village:talk_elder",
                "startQuest:rescue"
              ]
            }
          ]
        },
        "end": {
          "text": "Go carefully. Bring your men back, and do not make enemies of everyone in this valley.",
          "choices": []
        }
      }
    },
    {
      "id": "thanh",
      "name": "Thanh",
      "portrait": "👩",
      "nodes": {
        "root": {
          "text": "The jungle carries sound. You move like a storm, soldier. If you want help, you pay in trust.",
          "choices": [
            {
              "label": "Help me reach the camp unseen.",
              "go": "deal"
            },
            {
              "label": "Tell me about your brother Duc.",
              "go": "duc"
            }
          ]
        },
        "deal": {
          "text": "The tunnels can take you around their patrols. Bring my brother Duc back, and I will mark a safe route for you.",
          "choices": [
            {
              "label": "Deal. I'll find Duc.",
              "go": "route",
              "actions": [
                "setFlag:find_duc",
                "revealNpc:duc"
              ]
            },
            {
              "label": "I can't promise that.",
              "go": "cold"
            }
          ]
        },
        "duc": {
          "text": "He is young and stubborn. They grabbed him near the storage huts at the camp. If he still breathes, he will be there.",
          "choices": [
            {
              "label": "I will look for him.",
              "go": "route",
              "actions": [
                "setFlag:find_duc",
                "revealNpc:duc"
              ]
            }
          ]
        },
        "route": {
          "text": "Take the narrow gully northeast of the market, then cut west at the three palms. Less noise, fewer rifles.",
          "choices": [
            {
              "label": "Understood.",
              "go": null,
              "actions": [
                "setFlag:tunnel_access",
                "completeObjective:hearts_of_the_village:secure_local_trust",
                "resolution:nonviolent",
                "adjustTrust:6"
              ]
            }
          ]
        },
        "cold": {
          "text": "Then do not expect my people to risk themselves for you.",
          "choices": [
            {
              "label": "Fair.",
              "go": null
            }
          ]
        }
      }
    },
    {
      "id": "binh",
      "name": "Binh",
      "portrait": "🧢",
      "nodes": {
        "root": {
          "text": "You are the downed American, yes? People here are split. Some want to help, some want you gone.",
          "choices": [
            {
              "label": "Help me calm the village. I need guides, not fear.",
              "go": null,
              "actions": [
                "completeObjective:hearts_of_the_village:secure_local_trust",
                "resolution:nonviolent",
                "adjustTrust:4"
              ]
            },
            {
              "label": "I am not asking. You will cooperate.",
              "go": null,
              "actions": [
                "setFlag:binh_coerced",
                "completeObjective:hearts_of_the_village:secure_local_trust",
                "resolution:violent",
                "adjustTrust:-8"
              ]
            }
          ]
        }
      }
    },
    {
      "id": "father_bao",
      "name": "Father Bao",